{
  "name": "Illustrative direct-to-chip 1 MW",
  "cooling_architecture": "direct-to-chip",
  "study": {
    "functional_unit": "it_mwh",
    "system_boundary": "cooling_system_cradle_to_grave",
    "electricity_accounting": "location_based",
    "water_metric": "blue water consumption",
    "allocation_method": "cut-off with explicitly reported recovery credits",
    "intended_use": "software demonstration and method development",
    "comparative_assertion": false,
    "ghg_method": "illustrative GWP100",
    "primary_energy_method": "illustrative total primary energy",
    "water_method": "illustrative blue-water consumption",
    "replacement_model": "discrete",
    "critical_review_status": "not_required"
  },
  "it_capacity_kw": 1000,
  "capacity_factor": 0.75,
  "pue": 1.12,
  "facility_lifetime_years": 15,
  "onsite_water_l_per_kwh_it": 0.10,
  "grid": {
    "ghg_kgco2e_per_kwh": 0.35,
    "primary_energy_mj_per_kwh": 6.0,
    "blue_water_l_per_kwh": 0.30
  },
  "components": [
    {
      "name": "Cold plates, CDU, manifolds, and dry cooler package",
      "quantity": 1,
      "service_life_years": 15,
      "production": {
        "ghg_kgco2e": 230000,
        "primary_energy_mj": 3200000,
        "blue_water_l": 510000
      },
      "end_of_life": {
        "ghg_kgco2e": -17000,
        "primary_energy_mj": -210000,
        "blue_water_l": 8000
      }
    }
  ],
  "data_sources": [
    {
      "id": "illustrative-d2c-v0.2",
      "title": "Illustrative direct-to-chip example inputs",
      "source_type": "synthetic",
      "citation": "OpenDC-LCA example; no external source",
      "license": "MIT",
      "geography": "unspecified United States",
      "reference_year": 2026,
      "quality": "illustrative—not decision-grade",
      "uncertainty": {
        "distribution": "not_quantified",
        "parameters": {},
        "notes": "Synthetic values; do not interpret as confidence bounds."
      },
      "review_status": "unreviewed",
      "confidentiality": "public"
    }
  ],
  "metadata": {
    "data_quality": "illustrative",
    "warning": "Not decision-grade; replace all factors before research use."
  }
}
